{
  "$schema": "https://json-schema.org/draft/2020-12/schema",
  "title": "PublishedStyle",
  "type": "object",
  "description": "A set of published properties that can be applied to nodes.",
  "properties": {
    "key": {
      "type": "string",
      "description": "The unique identifier for the style"
    },
    "file_key": {
      "type": "string",
      "description": "The unique identifier of the Figma file that contains the style."
    },
    "node_id": {
      "type": "string",
      "description": "ID of the style node within the figma file"
    },
    "thumbnail_url": {
      "type": "string",
      "description": "A URL to a thumbnail image of the style."
    },
    "name": {
      "type": "string",
      "description": "The name of the style."
    },
    "description": {
      "type": "string",
      "description": "The description of the style as entered by the publisher."
    },
    "created_at": {
      "type": "string",
      "description": "The UTC ISO 8601 time when the style was created."
    },
    "updated_at": {
      "type": "string",
      "description": "The UTC ISO 8601 time when the style was last updated."
    },
    "sort_position": {
      "type": "string",
      "description": "A user specified order number by which the style can be sorted."
    }
  }
}